{
  "id": "projects",
  "name": "项目",
  "version": 1,
  "visibility": "agent",
  "description": "个人项目与工作",
  "records": {
    "project_metric": {
      "path": "data/metrics/{YYYY-MM}.jsonl",
      "schema": "schemas/project-metric.schema.json",
      "label": "项目进度"
    }
  },
  "agent": {
    "instructions": "每个项目一个子目录，含 STATUS.md、notes.md、log.md。用 kaitu project 管理与同步；项目内容在链接的文件夹里，只读。next 会出现在今天。仅本机项目通过 project 命令访问，不写入共享文件。"
  }
}
