{
  "id": "feed",
  "name": "动态",
  "version": 1,
  "visibility": "nav",
  "description": "每日简报、订阅源、兴趣关键词",
  "records": {
    "news_item": {
      "path": "data/news/{YYYY-MM}.jsonl",
      "schema": "schemas/news-item.schema.json",
      "label": "新闻"
    },
    "trend": {
      "path": "data/trends/{YYYY-MM}.jsonl",
      "schema": "schemas/trend.schema.json",
      "label": "X 热门"
    }
  },
  "views": [{ "type": "doc", "title": "今日简报", "path": "digests/{YYYY-MM-DD}.md" }],
  "agent": {
    "instructions": "先读 feed/COLLECT.md（采集规则），按其中的字段要求采集和投递。订阅源、兴趣关键词与 muted 在 feeds.json。早间计划时拉取订阅源，按兴趣筛选后写 digests/YYYY-MM-DD.md。发现和用户目标、在做的事、所在地有关的新闻就投递 news_item，写明 relevance.module 与 relevance.reason；X 热门写 trend。用现有新增记录工具或 inbox/agents/*.records.jsonl 投递，开图按 URL 去重新闻、按本地日期与 topic 修订热门。"
  }
}
