{
  "id": "explore",
  "name": "探索",
  "version": 1,
  "visibility": "agent",
  "description": "探索方向、依据、尝试与城市足迹",
  "records": {
    "experience": {
      "path": "data/experiences/{YYYY-MM}.jsonl",
      "schema": "schemas/experience.schema.json",
      "label": "地点经历"
    },
    "direction": {
      "path": "data/directions/{YYYY-MM}.jsonl",
      "schema": "schemas/direction.schema.json",
      "label": "探索方向"
    },
    "exploration_experiment": {
      "path": "data/experiments/{YYYY-MM}.jsonl",
      "schema": "schemas/exploration-experiment.schema.json",
      "label": "方向尝试"
    },
    "direction_note": {
      "path": "data/notes/{YYYY-MM}.jsonl",
      "schema": "schemas/direction-note.schema.json",
      "label": "方向资料与认识变化"
    }
  },
  "agent": {
    "instructions": "地点经历通过 experience_add 或 kaitu_add_experience 提交，只给城市名和国家代码，坐标由城市表解析。计划用 planned，歧义交给用户核对。 方向与实验通过 exploration_read / exploration_write（DSH 加 kaitu_ 前缀）读写，保留预期版本。AI 新方向只作 suggested，采纳、暂停和归档由用户决定。记录行动完成与假设结论两件事，负面证据和历史不删除。"
  }
}
